{
  "$schema": "http://json-schema.org/draft-07/schema#",
  "title": "Options Schema",
  "description": "Schema for options.json files containing unit/model customization options",
  "type": "array",
  "items": {
    "type": "object",
    "required": ["Id", "Name", "Type"],
    "properties": {
      "Id": {
        "type": "string",
        "description": "Unique identifier for the option"
      },
      "Name": {
        "type": "string",
        "description": "Name of the option"
      },
      "Type": {
        "type": "integer",
        "minimum": 0,
        "maximum": 7,
        "description": "Type of option - determines how it affects units/models (0=SwapUnit, 1=ModifyItemOnAll, 2=ModifyItemOnBasic, 3=SwapBasic, 4=ModifyItemOnSingle, 5=SwapSingle, 6=AddSingle, 7=AddExtras)"
      },
      "ItemsToAdd": {
        "type": "array",
        "description": "Array of items to add (statlines, rules, equipment, etc.)",
        "items": {
          "type": "object",
          "required": ["Id"],
          "properties": {
            "Id": {
              "type": "string",
              "description": "ID of the item to add"
            },
            "Info": {
              "type": "string",
              "description": "Optional additional information about the item"
            }
          },
          "additionalProperties": false
        }
      },
      "ExtraItems": {
        "type": "array",
        "description": "List of extra items (cards, units, etc.) associated with this option",
        "items": {
          "type": "object",
          "required": ["Id", "Type"],
          "properties": {
            "Id": {
              "type": "string",
              "description": "ID of the extra item. Just deployable items like cards, tokens, cardstacks or units for now, but could be extended to other types if needed"
            },
            "Type": {
              "type": "string",
              "enum": ["Unit", "Card", "Token", "Cardstack", "Rule", "Equipment", "Statline"],
              "description": "Type of the extra item"
            }
          },
          "additionalProperties": false
        }
      }
    },
    "additionalProperties": false
  }
}
