[
  {
    "Id": "6e278d4d-16f6-4493-9888-bb25737d0bde",
    "Name": "Lucrezzia Belladonna",
    "Type": 1,
    "ItemsToAdd": [
      {
        "Id": "rule_lucrezzia_belladonna_420630ff"
      }
    ]
  },
  {
    "Id": "eed84677-9e98-410b-837b-1014efd2697c",
    "Name": "Marco Colombo",
    "Type": 1,
    "ItemsToAdd": [
      {
        "Id": "rule_marco_colombo_ccd44131"
      }
    ]
  },
  {
    "Id": "3de223a5-ec66-4d1e-bc1d-2f42f5ae4600",
    "Name": "Borgio the Besieger",
    "Type": 1,
    "ItemsToAdd": [
      {
        "Id": "rule_borgio_the_besieger_79718451"
      }
    ]
  },
  {
    "Id": "fddd8f67-b8cf-4ece-b1cb-0f9ad7225416",
    "Name": "Lorenzo Lupo",
    "Type": 1,
    "ItemsToAdd": [
      {
        "Id": "rule_lorenzo_lupo_efdb881b"
      }
    ]
  },
  {
    "Id": "a557f029-beee-4409-a621-5a8bfa58931e",
    "Name": "Lietpold the Black",
    "Type": 1,
    "ItemsToAdd": [
      {
        "Id": "rule_lietpold_the_black_f415035e"
      }
    ]
  },
  {
    "Id": "e0ff0f1f-7ad7-42cf-8c0d-3d3a383c23fe",
    "Name": "Morgan Bernhardt",
    "Type": 1,
    "ItemsToAdd": [
      {
        "Id": "rule_morgan_bernhardt_0c787fd0"
      }
    ]
  },
  {
    "Id": "89debb15-8aa8-4f38-ab24-0618b49c719a",
    "Name": "Ulli & Marquand",
    "Type": 1,
    "ItemsToAdd": [
      {
        "Id": "rule_ulli_&_marquand_e33bff7d"
      }
    ]
  },
  {
    "Id": "f4e975e6-a30d-4951-88b6-b15cd28212d4",
    "Name": "Simius Gantt",
    "Type": 1,
    "ItemsToAdd": [
      {
        "Id": "rule_simius_gantt_f905fd57"
      }
    ]
  },
  {
    "Id": "2df085d0-5fec-4654-94a4-c5d844fbf2aa",
    "Name": "Nicodemus",
    "Type": 1,
    "ItemsToAdd": [
      {
        "Id": "rule_nicodemus_b4a1d2eb"
      }
    ]
  },
  {
    "Id": "1bce418c-5dd1-4365-b546-ba13d580558c",
    "Name": "Mydas the Mean",
    "Type": 1,
    "ItemsToAdd": [
      {
        "Id": "rule_mydas_the_mean_273776ec"
      }
    ]
  },
  {
    "Id": "6f3c5b71-100a-41f7-893b-f61541ae43af",
    "Name": "Marianna Chevaux",
    "Type": 1,
    "ItemsToAdd": [
      {
        "Id": "rule_marianna_chevaux_ba036442"
      }
    ]
  },
  {
    "Id": "2424e910-72d7-47ea-9368-cdc5e04628cb",
    "Name": "Aenur",
    "Type": 1,
    "ItemsToAdd": [
      {
        "Id": "rule_aenur_09190806"
      }
    ]
  },
  {
    "Id": "3f9144ab-0675-4ba1-ae83-398c4c222768",
    "Name": "Johann the Knife",
    "Type": 1,
    "ItemsToAdd": [
      {
        "Id": "rule_johann_the_knife_f60bbcad"
      }
    ]
  },
  {
    "Id": "83d13d90-ca37-4f53-82fb-fef9d998f803",
    "Name": "Leonardo Da Miragliano",
    "Type": 1,
    "ItemsToAdd": [
      {
        "Id": "rule_leonardo_da_miragliano_e92322b3"
      }
    ]
  }
]