[
  {
    "Id": "options_1770894215937",
    "Name": "Tesla Cannon",
    "Type": 1,
    "ItemsToAdd": [
      {
        "Id": "b10e-f630-e86d-cb02"
      }
    ]
  },
  {
    "Id": "options_1771235797800",
    "Name": "Overlord’s Blade",
    "Type": 1,
    "ItemsToAdd": [
      {
        "Id": "ee65-1ae9-d6a8-bd85"
      }
    ]
  },
  {
    "Id": "options_1771235915411",
    "Name": "Lord’s blade",
    "Type": 1,
    "ItemsToAdd": [
      {
        "Id": "3e51-82d1-9725-3333"
      }
    ]
  },
  {
    "Id": "options_1771236002120",
    "Name": "Nanoscarab Amulet",
    "Type": 2,
    "ItemsToAdd": [
      {
        "Id": "rule_222"
      }
    ]
  },
  {
    "Id": "options_1771236109788",
    "Name": "Resurrection Orb",
    "Type": 2,
    "ItemsToAdd": [
      {
        "Id": "rule_226"
      }
    ]
  },
  {
    "Id": "options_1771236504581",
    "Name": "Staff of Light",
    "Type": 1,
    "ItemsToAdd": [
      {
        "Id": "3bb9-cfd3-a1f4-1d39"
      },
      {
        "Id": "7403-f6-6b4-944f"
      }
    ]
  },
  {
    "Id": "options_1771236596818",
    "Name": "Voidscythe",
    "Type": 1,
    "ItemsToAdd": [
      {
        "Id": "6f84-3570-32eb-e1a3"
      }
    ]
  },
  {
    "Id": "options_1771236778186",
    "Name": "Tesla Carbine",
    "Type": 4,
    "ItemsToAdd": [
      {
        "Id": "64ad-95a3-ce2f-ecf2"
      }
    ]
  },
  {
    "Id": "options_1771237015566",
    "Name": "Gauss Reaper",
    "Type": 4,
    "ItemsToAdd": [
      {
        "Id": "6d5d-6878-1274-18cc"
      }
    ]
  },
  {
    "Id": "options_1771237161940",
    "Name": "Tesla Caster",
    "Type": 4,
    "ItemsToAdd": [
      {
        "Id": "equipment_1770897697685"
      }
    ]
  },
  {
    "Id": "options_1771237249957",
    "Name": "Accelerator Mandible",
    "Type": 4,
    "ItemsToAdd": [
      {
        "Id": "rules_1770897244884"
      }
    ]
  },
  {
    "Id": "options_1771237322487",
    "Name": "Nanoscarab Projector",
    "Type": 4,
    "ItemsToAdd": [
      {
        "Id": "rules_1770897260599"
      }
    ]
  },
  {
    "Id": "options_1771237444759",
    "Name": "2 Particle Beamers",
    "Type": 4,
    "ItemsToAdd": [
      {
        "Id": "903f-ac42-963b-ffd6"
      }
    ]
  },
  {
    "Id": "options_1771237520788",
    "Name": "Fabricator Claw Array",
    "Type": 4,
    "ItemsToAdd": [
      {
        "Id": "rule_271"
      }
    ]
  },
  {
    "Id": "options_1771237569079",
    "Name": "Gloom Prism",
    "Type": 4,
    "ItemsToAdd": [
      {
        "Id": "rule_320"
      }
    ]
  },
  {
    "Id": "options_1771237623235",
    "Name": "Transdimensional Isolator",
    "Type": 4,
    "ItemsToAdd": [
      {
        "Id": "equipment_1770899005594"
      }
    ]
  },
  {
    "Id": "options_1771237706128",
    "Name": "Particle Caster",
    "Type": 4,
    "ItemsToAdd": [
      {
        "Id": "7ba3-7c24-b653-d281"
      }
    ]
  },
  {
    "Id": "options_1771237754123",
    "Name": "Transdimensional Beamer",
    "Type": 4,
    "ItemsToAdd": [
      {
        "Id": "58e9-d6a8-2615-fbda"
      }
    ]
  },
  {
    "Id": "options_1771237803526",
    "Name": "Whip Coils",
    "Type": 4,
    "ItemsToAdd": [
      {
        "Id": "db2f-a98e-4d59-6193"
      }
    ]
  },
  {
    "Id": "options_1771237884618",
    "Name": "Enmitic Exterminator.",
    "Type": 4,
    "ItemsToAdd": [
      {
        "Id": "352f-e231-877a-fc51"
      }
    ]
  },
  {
    "Id": "options_1771237968359",
    "Name": "Hyperphase Sword & Dispersion Shield",
    "Type": 4,
    "ItemsToAdd": [
      {
        "Id": "c473-cc38-3b86-f24a"
      },
      {
        "Id": "rule_252"
      }
    ]
  },
  {
    "Id": "options_1771238334779",
    "Name": "4 Death Rays",
    "Type": 4,
    "ItemsToAdd": [
      {
        "Id": "de95-9dd7-c085-26c3"
      }
    ]
  },
  {
    "Id": "options_1771238514697",
    "Name": "Plasmacyte",
    "Type": 6,
    "ExtraItems": [
      {
        "Id": "tokens_1771238685137",
        "Type": "Token"
      }
    ]
  },
  {
    "Id": "options_1771239455921",
    "Name": "Particle Beamer",
    "Type": 4,
    "ItemsToAdd": [
      {
        "Id": "2791-9fe6-3479-547"
      }
    ]
  },
  {
    "Id": "options_1771239516069",
    "Name": "Twin Tesla Carbine",
    "Type": 4,
    "ItemsToAdd": [
      {
        "Id": "551a-9c49-858c-f83d"
      }
    ]
  },
  {
    "Id": "options_1771239587677",
    "Name": "Shieldvanes",
    "Type": 4,
    "ItemsToAdd": [
      {
        "Id": "rule_280"
      }
    ]
  },
  {
    "Id": "options_1771239634982",
    "Name": "Nebuloscope",
    "Type": 4,
    "ItemsToAdd": [
      {
        "Id": "rule_279"
      }
    ]
  },
  {
    "Id": "options_1771239670270",
    "Name": "Shadowloom",
    "Type": 4,
    "ItemsToAdd": [
      {
        "Id": "rule_278"
      }
    ]
  },
  {
    "Id": "options_1771239709352",
    "Name": "Particle Caster & Voidblade.",
    "Type": 4,
    "ItemsToAdd": [
      {
        "Id": "4a54-5368-186c-3e5a"
      },
      {
        "Id": "70cb-2c07-d39d-c741"
      }
    ]
  },
  {
    "Id": "options_1771239830697",
    "Name": "Particle Shredder",
    "Type": 4,
    "ItemsToAdd": [
      {
        "Id": "368a-9e23-69ff-75a7"
      }
    ]
  },
  {
    "Id": "options_1771239887065",
    "Name": "Heavy Gauss Cannon Array",
    "Type": 4,
    "ItemsToAdd": [
      {
        "Id": "231d-94d0-55e7-9098"
      }
    ]
  },
  {
    "Id": "options_1771239946142",
    "Name": "2 Synaptic Obliterators & 2 Transdimensional Projectors",
    "Type": 1,
    "ItemsToAdd": [
      {
        "Id": "d103-220a-14-bebd"
      },
      {
        "Id": "d56a-467d-ecb9-9b6"
      }
    ]
  }
]