[
  {
    "Id": "options_1773326608126",
    "Name": "Cult Sniper & Close Combat Weapon.",
    "Type": 1,
    "ItemsToAdd": [
      {
        "Id": "85d6-5734-14b3-2203"
      },
      {
        "Id": "equipment_1773325629745"
      }
    ]
  },
  {
    "Id": "options_1773327156138",
    "Name": "Cult Icon",
    "Type": 4,
    "ItemsToAdd": [
      {
        "Id": "rule_3864"
      }
    ]
  },
  {
    "Id": "options_1773327199481",
    "Name": "Heavy Mining Tool",
    "Type": 4,
    "ItemsToAdd": [
      {
        "Id": "174b-b4c0-d61d-dfb9"
      }
    ]
  },
  {
    "Id": "options_1773327263441",
    "Name": "Leader's bio-weapons",
    "Type": 4,
    "ItemsToAdd": [
      {
        "Id": "dc5c-4c49-337b-4281"
      }
    ]
  },
  {
    "Id": "options_1773327657908",
    "Name": "Demolition Charges",
    "Type": 4,
    "ItemsToAdd": [
      {
        "Id": "8429-4679-97cf-4b05"
      }
    ]
  },
  {
    "Id": "options_1773328423089",
    "Name": "Heavy stubber",
    "Type": 4,
    "ItemsToAdd": [
      {
        "Id": "c8a1-9a5-b48e-135f"
      }
    ]
  },
  {
    "Id": "options_1773328451582",
    "Name": "Mining laser",
    "Type": 4,
    "ItemsToAdd": [
      {
        "Id": "5868-96cd-cdcc-2943"
      }
    ]
  },
  {
    "Id": "options_1773328489082",
    "Name": "Seismic cannon",
    "Type": 4,
    "ItemsToAdd": [
      {
        "Id": "8e40-1ced-3c41-9851"
      }
    ]
  },
  {
    "Id": "options_1773328543398",
    "Name": "Flamer",
    "Type": 4,
    "ItemsToAdd": [
      {
        "Id": "de59-6c4-4556-6c0e"
      }
    ]
  },
  {
    "Id": "options_1773328573997",
    "Name": "Grenade launcher",
    "Type": 4,
    "ItemsToAdd": [
      {
        "Id": "4a9d-f7f6-4026-5273"
      },
      {
        "Id": "f16-d4b5-befc-8fd7"
      }
    ]
  },
  {
    "Id": "options_1773328600423",
    "Name": "Webber",
    "Type": 4,
    "ItemsToAdd": [
      {
        "Id": "9311-dec4-b9c3-a03"
      }
    ]
  },
  {
    "Id": "options_1773328695135",
    "Name": "Anointed Pistol & Chainsword",
    "Type": 4,
    "ItemsToAdd": [
      {
        "Id": "b6cb-8dfa-d136-2ad4"
      },
      {
        "Id": "a96c-7c07-976b-409a"
      }
    ]
  },
  {
    "Id": "options_1773328764003",
    "Name": "Anointed Pistol & Power Weapon",
    "Type": 4,
    "ItemsToAdd": [
      {
        "Id": "b6cb-8dfa-d136-2ad4"
      },
      {
        "Id": "535f-b966-6118-9040"
      }
    ]
  },
  {
    "Id": "options_1773329318249",
    "Name": "Achilles Missile Launcher",
    "Type": 4,
    "ItemsToAdd": [
      {
        "Id": "445c-216b-baa5-214"
      }
    ]
  },
  {
    "Id": "options_1773329356755",
    "Name": "Heavy Mortar",
    "Type": 4,
    "ItemsToAdd": [
      {
        "Id": "ea6f-9f30-3a62-379"
      }
    ]
  },
  {
    "Id": "options_1773329394927",
    "Name": "Spotter",
    "Type": 4,
    "ItemsToAdd": [
      {
        "Id": "rule_3815"
      }
    ]
  },
  {
    "Id": "options_1773329427906",
    "Name": "Survey Augur",
    "Type": 4,
    "ItemsToAdd": [
      {
        "Id": "rule_3816"
      }
    ]
  },
  {
    "Id": "options_1773329829659",
    "Name": "Atalan Power Weapon",
    "Type": 4,
    "ItemsToAdd": [
      {
        "Id": "5ab5-695a-fbe9-39e1"
      }
    ]
  },
  {
    "Id": "options_1773329900263",
    "Name": "Atalan Incinerator",
    "Type": 4,
    "ItemsToAdd": [
      {
        "Id": "1aa5-8d88-59da-bac3"
      }
    ]
  },
  {
    "Id": "options_1773329949658",
    "Name": "Mining Laser",
    "Type": 4,
    "ItemsToAdd": [
      {
        "Id": "32fb-3f61-367c-fb71"
      }
    ]
  },
  {
    "Id": "options_1773392317408",
    "Name": "Hand Flamer",
    "Type": 4,
    "ItemsToAdd": [
      {
        "Id": "2674-bc9a-7cbf-6c68"
      }
    ]
  }
]