[
  {
    "Id": "options_1771836629078",
    "Name": "Blast Pistol",
    "Type": 1,
    "ItemsToAdd": [
      {
        "Id": "9a52-4491-7eae-8c43"
      }
    ]
  },
  {
    "Id": "options_1771836680348",
    "Name": "Soul Trap",
    "Type": 1,
    "ItemsToAdd": [
      {
        "Id": "rules_1771836061760"
      }
    ]
  },
  {
    "Id": "options_1771836724868",
    "Name": "Agoniser",
    "Type": 1,
    "ItemsToAdd": [
      {
        "Id": "b856-1d1d-8ac1-85ec"
      }
    ]
  },
  {
    "Id": "options_1771836757124",
    "Name": "Master-crafted Power Weapon",
    "Type": 1,
    "ItemsToAdd": [
      {
        "Id": "equipment_1761812692853"
      }
    ]
  },
  {
    "Id": "options_1771843049594",
    "Name": "Power Weapon",
    "Type": 4,
    "ItemsToAdd": [
      {
        "Id": "equipment_1761814582153"
      }
    ]
  },
  {
    "Id": "options_1771843094802",
    "Name": "Kabalite Icon",
    "Type": 4,
    "ItemsToAdd": [
      {
        "Id": "rules_1771843130599"
      }
    ]
  },
  {
    "Id": "options_1771843172367",
    "Name": "Phantasm Grenade Launcher",
    "Type": 4,
    "ItemsToAdd": [
      {
        "Id": "rule_1846"
      }
    ]
  },
  {
    "Id": "options_1771843272705",
    "Name": "Blast Pistol",
    "Type": 4,
    "ItemsToAdd": [
      {
        "Id": "59c1-f7b9-f86c-6cbb"
      }
    ]
  },
  {
    "Id": "options_1771843356164",
    "Name": "Splinter Pistol",
    "Type": 4,
    "ItemsToAdd": [
      {
        "Id": "71b5-8a93-8a3f-924d"
      }
    ]
  },
  {
    "Id": "options_1771843528552",
    "Name": "Blaster",
    "Type": 4,
    "ItemsToAdd": [
      {
        "Id": "147b-c104-ef93-7111"
      }
    ]
  },
  {
    "Id": "options_1771843572183",
    "Name": "Dark Lance",
    "Type": 4,
    "ItemsToAdd": [
      {
        "Id": "8c0e-9b20-8e64-cd04"
      }
    ]
  },
  {
    "Id": "options_1771843700387",
    "Name": "Shredder",
    "Type": 4,
    "ItemsToAdd": [
      {
        "Id": "7a3e-6720-5c8-1afe"
      }
    ]
  },
  {
    "Id": "options_1771843748888",
    "Name": "Splinter Cannon",
    "Type": 4,
    "ItemsToAdd": [
      {
        "Id": "d58-3463-a019-9da3"
      }
    ]
  },
  {
    "Id": "options_1771845104459",
    "Name": "Hexrifle & Torturer’s Tool",
    "Type": 4,
    "ItemsToAdd": [
      {
        "Id": "fe1e-9d52-ac-ad66"
      },
      {
        "Id": "equipment_1761814870144"
      }
    ]
  },
  {
    "Id": "options_1771845168383",
    "Name": "Liquifier Gun & Torturer’s Tool",
    "Type": 4,
    "ItemsToAdd": [
      {
        "Id": "aff0-96bd-a962-9304"
      },
      {
        "Id": "equipment_1761814870144"
      }
    ]
  },
  {
    "Id": "options_1771845219140",
    "Name": "Ossefactor & Torturer’s Tool",
    "Type": 4,
    "ItemsToAdd": [
      {
        "Id": "dfc7-bef0-5c30-9d02"
      },
      {
        "Id": "equipment_1761814870144"
      }
    ]
  },
  {
    "Id": "options_1771845281551",
    "Name": "Stinger Pistol & Torturer’s Tool",
    "Type": 4,
    "ItemsToAdd": [
      {
        "Id": "3fb5-fed9-c125-97a7"
      },
      {
        "Id": "equipment_1761814870144"
      }
    ]
  },
  {
    "Id": "options_1771845330010",
    "Name": "Power Weapon & Torturer’s Tool.",
    "Type": 4,
    "ItemsToAdd": [
      {
        "Id": "equipment_1771844689732"
      },
      {
        "Id": "equipment_1761814870144"
      }
    ]
  },
  {
    "Id": "options_1771846701913",
    "Name": "Gladiatorial Weapons",
    "Type": 4,
    "ItemsToAdd": [
      {
        "Id": "equipment_1761815135333"
      }
    ]
  },
  {
    "Id": "options_1771848417969",
    "Name": "Neuro Disruptor",
    "Type": 4,
    "ItemsToAdd": [
      {
        "Id": "1cf4-43f7-4ff2-b8a4"
      }
    ]
  },
  {
    "Id": "options_1771848490979",
    "Name": "Shuriken Rifle",
    "Type": 4,
    "ItemsToAdd": [
      {
        "Id": "2522-d81b-7b47-3b25"
      }
    ]
  },
  {
    "Id": "options_1771848689805",
    "Name": "shuriken cannon",
    "Type": 4,
    "ItemsToAdd": [
      {
        "Id": "7eb5-647a-82c8-4309"
      }
    ]
  },
  {
    "Id": "options_1771848739161",
    "Name": "Wraithcannon",
    "Type": 4,
    "ItemsToAdd": [
      {
        "Id": "9f0d-2a87-98eb-5cfb"
      }
    ]
  },
  {
    "Id": "options_1771855173950",
    "Name": "Stinger Pistol",
    "Type": 4,
    "ItemsToAdd": [
      {
        "Id": "b039-d693-86fe-4cc7"
      }
    ]
  },
  {
    "Id": "options_1771855227251",
    "Name": "Shardcarbine",
    "Type": 4,
    "ItemsToAdd": [
      {
        "Id": "e2bd-2fa5-4a4b-e552"
      }
    ]
  },
  {
    "Id": "options_1771855257987",
    "Name": "Pain Sculptors",
    "Type": 4,
    "ItemsToAdd": [
      {
        "Id": "equipment_1761816476334"
      }
    ]
  },
  {
    "Id": "options_1771855306347",
    "Name": "Splinter Pistol & Razorflail",
    "Type": 4,
    "ItemsToAdd": [
      {
        "Id": "71b5-8a93-8a3f-924d"
      },
      {
        "Id": "equipment_1761816572389"
      }
    ]
  },
  {
    "Id": "options_1771855385167",
    "Name": "Stimm-needler",
    "Type": 4,
    "ItemsToAdd": [
      {
        "Id": "rules_1771855406456"
      }
    ]
  },
  {
    "Id": "options_1771856218542",
    "Name": "Splinter Pistol & Power Weapon",
    "Type": 4,
    "ItemsToAdd": [
      {
        "Id": "71b5-8a93-8a3f-924d"
      },
      {
        "Id": "equipment_1771856001183"
      }
    ]
  },
  {
    "Id": "options_1771856282354",
    "Name": "Splinter Pistol & Stunclaw",
    "Type": 4,
    "ItemsToAdd": [
      {
        "Id": "71b5-8a93-8a3f-924d"
      },
      {
        "Id": "equipment_1761816946844"
      }
    ]
  },
  {
    "Id": "options_1771856380791",
    "Name": "Splinter Pistol & Hellglaive",
    "Type": 4,
    "ItemsToAdd": [
      {
        "Id": "71b5-8a93-8a3f-924d"
      }
    ]
  },
  {
    "Id": "options_1771857057355",
    "Name": "Demiklaives",
    "Type": 4,
    "ItemsToAdd": [
      {
        "Id": "18c6-d3d-2197-925c"
      },
      {
        "Id": "dd06-c3a6-9bd1-13e7"
      }
    ]
  },
  {
    "Id": "options_1771857096668",
    "Name": "Incubi Shrine token",
    "Type": 4,
    "ItemsToAdd": [
      {
        "Id": "rules_1771857029136"
      }
    ]
  },
  {
    "Id": "options_1771863279827",
    "Name": "2 Disintegrator Cannons",
    "Type": 1,
    "ItemsToAdd": [
      {
        "Id": "8ac9-bd8f-3c8f-20b2"
      }
    ]
  },
  {
    "Id": "options_1771863320250",
    "Name": "Splinter Cannon",
    "Type": 1,
    "ItemsToAdd": [
      {
        "Id": "2d92-9836-d7f3-eead"
      }
    ]
  },
  {
    "Id": "options_1771863957503",
    "Name": "Heat Lance",
    "Type": 4,
    "ItemsToAdd": [
      {
        "Id": "944f-56c1-8fdf-417a"
      }
    ]
  },
  {
    "Id": "options_1771864162252",
    "Name": "Cluster Caltrops",
    "Type": 4,
    "ItemsToAdd": [
      {
        "Id": "rule_2016"
      }
    ]
  },
  {
    "Id": "options_1771864201185",
    "Name": "Grav-talon",
    "Type": 4,
    "ItemsToAdd": [
      {
        "Id": "rules_1771864219159"
      }
    ]
  },
  {
    "Id": "options_1771865266712",
    "Name": "Blast Pistol & Power Weapon",
    "Type": 4,
    "ItemsToAdd": [
      {
        "Id": "59c1-f7b9-f86c-6cbb"
      },
      {
        "Id": "equipment_1761814582153"
      }
    ]
  },
  {
    "Id": "options_1771865450620",
    "Name": "Haywire Blaster",
    "Type": 4,
    "ItemsToAdd": [
      {
        "Id": "equipment_1764673833426"
      }
    ]
  },
  {
    "Id": "options_1771867166682",
    "Name": "Stinger Pod",
    "Type": 4,
    "ItemsToAdd": [
      {
        "Id": "d9a5-dd35-4192-d5b"
      }
    ]
  },
  {
    "Id": "options_1771867212220",
    "Name": "Twin Haywire Blaster",
    "Type": 4,
    "ItemsToAdd": [
      {
        "Id": "3024-e635-ec49-a675"
      }
    ]
  },
  {
    "Id": "options_1771867246456",
    "Name": "Twin Heat Lance",
    "Type": 4,
    "ItemsToAdd": [
      {
        "Id": "equipment_1771866577505"
      }
    ]
  },
  {
    "Id": "options_1771867284138",
    "Name": "Talos Ichor Injector",
    "Type": 4,
    "ItemsToAdd": [
      {
        "Id": "675a-591f-9994-3e6d"
      }
    ]
  },
  {
    "Id": "options_1771867318461",
    "Name": "Twin Liquifier Gun",
    "Type": 4,
    "ItemsToAdd": [
      {
        "Id": "ffc0-37b8-452a-d83d"
      }
    ]
  },
  {
    "Id": "options_1771867352207",
    "Name": "Chain Flails",
    "Type": 4,
    "ItemsToAdd": [
      {
        "Id": "d94a-9048-69f0-fd75"
      }
    ]
  },
  {
    "Id": "options_1771867396705",
    "Name": "Talos gauntlet",
    "Type": 4,
    "ItemsToAdd": [
      {
        "Id": "ad2d-d40c-6967-edcd"
      }
    ]
  },
  {
    "Id": "options_1771867906061",
    "Name": "2 Dark Scythes",
    "Type": 1,
    "ItemsToAdd": [
      {
        "Id": "equipment_1771867613101"
      }
    ]
  }
]