[
  {
    "Id": "options_1774968674639",
    "Name": "Ectoplasma destructor",
    "Type": 1,
    "ItemsToAdd": [
      {
        "Id": "equipment_1774968035989"
      }
    ]
  },
  {
    "Id": "options_1774968698356",
    "Name": "Magma cutters",
    "Type": 1,
    "ItemsToAdd": [
      {
        "Id": "equipment_1774968151566"
      }
    ]
  },
  {
    "Id": "options_1774968724514",
    "Name": "Hades lascannon",
    "Type": 1,
    "ItemsToAdd": [
      {
        "Id": "equipment_1774968265509"
      }
    ]
  },
  {
    "Id": "options_1774968803866",
    "Name": "Heavy reaper autocannon",
    "Type": 1,
    "ItemsToAdd": [
      {
        "Id": "equipment_1774968314677"
      }
    ]
  },
  {
    "Id": "options_1774968848614",
    "Name": "Electroscourge",
    "Type": 1,
    "ItemsToAdd": [
      {
        "Id": "equipment_1774968598262"
      }
    ]
  },
  {
    "Id": "options_1775735277154",
    "Name": "Axe of Khorne & Bloodflail",
    "Type": 1,
    "ItemsToAdd": [
      {
        "Id": "6260-10af-22ef-f664"
      },
      {
        "Id": "a72c-25d4-1924-fe3c"
      },
      {
        "Id": "6fe5-b0db-58e3-ab95"
      }
    ]
  },
  {
    "Id": "options_1775735331334",
    "Name": "Axe of Khorne & Lash of Khorne",
    "Type": 1,
    "ItemsToAdd": [
      {
        "Id": "6260-10af-22ef-f664"
      },
      {
        "Id": "a72c-25d4-1924-fe3c"
      },
      {
        "Id": "a6a3-e0e6-f400-ac07"
      }
    ]
  },
  {
    "Id": "options_1777368752119",
    "Name": "Instrument of Chaos",
    "Type": 4,
    "ItemsToAdd": [
      {
        "Id": "rule_625"
      }
    ]
  },
  {
    "Id": "options_1777368785962",
    "Name": "Daemonic icon",
    "Type": 4,
    "ItemsToAdd": [
      {
        "Id": "rule_624"
      }
    ]
  },
  {
    "Id": "options_1777369509368",
    "Name": "Plasma Pistol",
    "Type": 4,
    "ItemsToAdd": [
      {
        "Id": "equipment_1777369223316"
      },
      {
        "Id": "equipment_1777369196864"
      }
    ]
  },
  {
    "Id": "options_1777369576406",
    "Name": "Khornate Eviscerator",
    "Type": 4,
    "ItemsToAdd": [
      {
        "Id": "1438-6f84-786f-794d"
      }
    ]
  },
  {
    "Id": "options_1777369605738",
    "Name": "Icon of Khorne",
    "Type": 4,
    "ItemsToAdd": [
      {
        "Id": "rule_1311"
      }
    ]
  },
  {
    "Id": "options_1777369863193",
    "Name": "Combi-weapon",
    "Type": 1,
    "ItemsToAdd": [
      {
        "Id": "5397-9c3d-25dc-9f25"
      }
    ]
  },
  {
    "Id": "options_1777369985876",
    "Name": "Havoc launcher",
    "Type": 1,
    "ItemsToAdd": [
      {
        "Id": "0bbc-60b7-e869-01a8"
      }
    ]
  },
  {
    "Id": "options_1777371633224",
    "Name": "Combi-bolter",
    "Type": 1,
    "ItemsToAdd": [
      {
        "Id": "8055-8f34-66e4-dc87"
      }
    ]
  },
  {
    "Id": "options_1777371819860",
    "Name": "2 heavy bolters",
    "Type": 1,
    "ItemsToAdd": [
      {
        "Id": "55cd-6458-4bb4-8c5c"
      }
    ]
  },
  {
    "Id": "options_1777371853966",
    "Name": "2 lascannons",
    "Type": 1,
    "ItemsToAdd": [
      {
        "Id": "1b09-07ca-bfa2-b30f"
      }
    ]
  },
  {
    "Id": "options_1777372841973",
    "Name": "Heavy flamer",
    "Type": 4,
    "ItemsToAdd": [
      {
        "Id": "ab67-d80a-c94c-e6e3"
      }
    ]
  },
  {
    "Id": "options_1777372881382",
    "Name": "Reaper Autocannon",
    "Type": 4,
    "ItemsToAdd": [
      {
        "Id": "2db4-7c20-3e1d-77ff"
      }
    ]
  },
  {
    "Id": "options_1777372937144",
    "Name": "Combi-weapon",
    "Type": 4,
    "ItemsToAdd": [
      {
        "Id": "5397-9c3d-25dc-9f25"
      }
    ]
  },
  {
    "Id": "options_1777372978538",
    "Name": "Paired Accursed Weapons",
    "Type": 4,
    "ItemsToAdd": [
      {
        "Id": "d4df-8ce0-767a-474d"
      }
    ]
  },
  {
    "Id": "options_1777373011341",
    "Name": "Power Fist",
    "Type": 4,
    "ItemsToAdd": [
      {
        "Id": "93fd-b43b-37d3-e3a3"
      }
    ]
  },
  {
    "Id": "options_1777373093339",
    "Name": "Chainfist",
    "Type": 4,
    "ItemsToAdd": [
      {
        "Id": "6044-c4f2-8321-fd60"
      }
    ]
  },
  {
    "Id": "options_1777374951025",
    "Name": "2 Ectoplasma Cannons",
    "Type": 1,
    "ItemsToAdd": [
      {
        "Id": "f2ce-191d-8203-cfcd"
      }
    ]
  },
  {
    "Id": "options_1777375012924",
    "Name": "Ectoplasma cannon & Forgefiend claws",
    "Type": 1,
    "ItemsToAdd": [
      {
        "Id": "f2ce-191d-8203-cfcd"
      },
      {
        "Id": "ed63-295b-eaeb-eae2"
      }
    ]
  },
  {
    "Id": "options_1777375577357",
    "Name": "Autopistol",
    "Type": 4,
    "ItemsToAdd": [
      {
        "Id": "3662-4f69-8bee-ee9f"
      }
    ]
  },
  {
    "Id": "options_1777375611492",
    "Name": "Blood Harpoon",
    "Type": 4,
    "ItemsToAdd": [
      {
        "Id": "2ab9-9476-357e-da20"
      }
    ]
  },
  {
    "Id": "options_1777376776652",
    "Name": "Plasma cannon",
    "Type": 1,
    "ItemsToAdd": [
      {
        "Id": "55df-3e4e-7496-90c5"
      }
    ]
  },
  {
    "Id": "options_1777376810338",
    "Name": "Twin autocannon",
    "Type": 1,
    "ItemsToAdd": [
      {
        "Id": "d49f-822-633e-12e"
      }
    ]
  },
  {
    "Id": "options_1777376869550",
    "Name": "Twin heavy bolter",
    "Type": 1,
    "ItemsToAdd": [
      {
        "Id": "fc72-9f62-b714-d195"
      }
    ]
  },
  {
    "Id": "options_1777376905477",
    "Name": "Twin lascannon",
    "Type": 1,
    "ItemsToAdd": [
      {
        "Id": "9eb6-d9a7-c754-c1a6"
      }
    ]
  },
  {
    "Id": "options_1777376947268",
    "Name": "Helbrute fist",
    "Type": 1,
    "ItemsToAdd": [
      {
        "Id": "9cf0-22da-7500-4848"
      }
    ]
  },
  {
    "Id": "options_1777376988461",
    "Name": "Helbrute hammer",
    "Type": 1,
    "ItemsToAdd": [
      {
        "Id": "fc6f-24af-e553-0c3d"
      }
    ]
  },
  {
    "Id": "options_1777377012516",
    "Name": "Power scourge",
    "Type": 1,
    "ItemsToAdd": [
      {
        "Id": "b7a2-e159-fe07-db5d"
      }
    ]
  },
  {
    "Id": "options_1777377048978",
    "Name": "Heavy flamer",
    "Type": 1,
    "ItemsToAdd": [
      {
        "Id": "ab67-d80a-c94c-e6e3"
      }
    ]
  },
  {
    "Id": "options_1777377398538",
    "Name": "Baleflamer",
    "Type": 1,
    "ItemsToAdd": [
      {
        "Id": "a649-2296-8c56-08cd"
      }
    ]
  },
  {
    "Id": "options_1777377688756",
    "Name": "Mauler chainblade",
    "Type": 4,
    "ItemsToAdd": [
      {
        "Id": "c75c-6f52-8160-7262"
      }
    ]
  },
  {
    "Id": "options_1777377714710",
    "Name": "Skullsmasher and Mangler",
    "Type": 4,
    "ItemsToAdd": [
      {
        "Id": "ab0e-4569-3ddc-3e81"
      }
    ]
  },
  {
    "Id": "options_1777377942860",
    "Name": "Daemongore cannon",
    "Type": 1,
    "ItemsToAdd": [
      {
        "Id": "046f-8be9-131b-0ed8"
      }
    ]
  },
  {
    "Id": "options_1777377972844",
    "Name": "Ichor cannon",
    "Type": 1,
    "ItemsToAdd": [
      {
        "Id": "624a-be29-77f2-203b"
      }
    ]
  },
  {
    "Id": "options_1777378004517",
    "Name": "Skullhurler",
    "Type": 1,
    "ItemsToAdd": [
      {
        "Id": "1f29-6965-2404-190c"
      }
    ]
  }
]