[
  {
    "Id": "options_1775472743397",
    "Name": "Bellatus reaper chainsword",
    "Type": 1,
    "ItemsToAdd": [
      {
        "Id": "equipment_1775465700403"
      },
      {
        "Id": "equipment_1775465716179"
      }
    ]
  },
  {
    "Id": "options_1775472794571",
    "Name": "Thundershock spear",
    "Type": 1,
    "ItemsToAdd": [
      {
        "Id": "equipment_1775472034002"
      },
      {
        "Id": "equipment_1775472088912"
      }
    ]
  },
  {
    "Id": "options_1775634549467",
    "Name": "Questoris heavy stubber",
    "Type": 1,
    "ItemsToAdd": [
      {
        "Id": "19b5-e47a-9e29-d6db"
      }
    ]
  },
  {
    "Id": "options_1775634611685",
    "Name": "Rapid-fire battle cannon & Questoris heavy stubber",
    "Type": 1,
    "ItemsToAdd": [
      {
        "Id": "e63e-93fd-e131-fe85"
      },
      {
        "Id": "19b5-e47a-9e29-d6db"
      }
    ]
  },
  {
    "Id": "options_1775634672761",
    "Name": "Ironstorm missile pod",
    "Type": 1,
    "ItemsToAdd": [
      {
        "Id": "712a-105f-a24e-badb"
      }
    ]
  },
  {
    "Id": "options_1775634701799",
    "Name": "Stormspear rocket pod",
    "Type": 1,
    "ItemsToAdd": [
      {
        "Id": "4dbb-a82d-89ff-e62e"
      }
    ]
  },
  {
    "Id": "options_1775634736314",
    "Name": "Twin Icarus autocannon",
    "Type": 1,
    "ItemsToAdd": [
      {
        "Id": "equipment_1762431766337"
      }
    ]
  },
  {
    "Id": "options_1775637125832",
    "Name": "Thunderstrike gauntlet",
    "Type": 1,
    "ItemsToAdd": [
      {
        "Id": "d2f7-1f2a-e319-9e6a"
      },
      {
        "Id": "dc7b-57c8-2678-6b40"
      }
    ]
  },
  {
    "Id": "options_1775639441628",
    "Name": "Meltagun",
    "Type": 1,
    "ItemsToAdd": [
      {
        "Id": "4b6f-2df5-d7b6-34dd"
      }
    ]
  },
  {
    "Id": "options_1775643294113",
    "Name": "Hekaton siege claw & Twin rad cleanser",
    "Type": 1,
    "ItemsToAdd": [
      {
        "Id": "equipment_1762510001131"
      },
      {
        "Id": "equipment_1762510128819"
      },
      {
        "Id": "3a9f-c444-b1d4-c31c"
      }
    ]
  },
  {
    "Id": "options_1775644707212",
    "Name": "helios defence missiles",
    "Type": 1,
    "ItemsToAdd": [
      {
        "Id": "ee88-6de7-ede9-c612"
      }
    ]
  },
  {
    "Id": "options_1775644716057",
    "Name": "2 Lascannons",
    "Type": 1,
    "ItemsToAdd": [
      {
        "Id": "1898-d8d0-7e42-652d"
      }
    ]
  },
  {
    "Id": "options_1775644799757",
    "Name": "Acastus autocannon & Lascannon",
    "Type": 1,
    "ItemsToAdd": [
      {
        "Id": "1898-d8d0-7e42-652d"
      }
    ]
  },
  {
    "Id": "options_1775645083898",
    "Name": "Siege claw & Rad cleanser",
    "Type": 1,
    "ItemsToAdd": [
      {
        "Id": "165d-95f5-f19e-8016"
      },
      {
        "Id": "ec3a-304-38d3-eb09"
      }
    ]
  },
  {
    "Id": "options_1775645301053",
    "Name": "Lightning lock",
    "Type": 1,
    "ItemsToAdd": [
      {
        "Id": "b9d1-1e57-836-a531"
      }
    ]
  },
  {
    "Id": "options_1775645391830",
    "Name": "Conversion beam cannon",
    "Type": 1,
    "ItemsToAdd": [
      {
        "Id": "fec2-9b94-3ebd-f1a4"
      }
    ]
  },
  {
    "Id": "options_1775645443122",
    "Name": "Graviton pulsar",
    "Type": 1,
    "ItemsToAdd": [
      {
        "Id": "9401-8675-2bac-35b"
      }
    ]
  },
  {
    "Id": "options_1775645466972",
    "Name": "Volkite veuglaire",
    "Type": 1,
    "ItemsToAdd": [
      {
        "Id": "b5d6-3736-74ec-1e93"
      }
    ]
  }
]